{
  "protocol_version": 2,
  "snapshot_sha256": "fcb7d2471cb0756fb7eaf817c233522c9457861469eb7b68e87a826aebaaf4a8",
  "change_id": "H01",
  "record_sha256": "4c3ad44707d77632068ad0c0df1548a7a17dd52a1ae5d228015890d9e7bcfda6",
  "scoring_policy": {
    "mode": "scoped_reference_v1"
  },
  "artifacts": [
    {
      "path": "harness/verification/discovery/http/evidence/H01-attempt-a/CatalogDiscoveryTest.java",
      "sha256": "52e3827592bda4c4ca0f8270f6c53e551bb7cff7849e47e2b7e11d0117c27e77"
    },
    {
      "path": "harness/verification/discovery/http/evidence/H01-attempt-a/baseline-boundary-test.log",
      "sha256": "1152abe462b3aaef2abcc4bb33d19c864d724ddedb8d9ba91b1d23c7d9e1a4f5"
    },
    {
      "path": "harness/verification/discovery/http/evidence/H01-attempt-a/baseline-junit.xml",
      "sha256": "01444e6d5eceac07cb47a67a51ac9201e6cd345b26f59c9df9eef77659d2d741"
    },
    {
      "path": "harness/verification/discovery/http/evidence/H01-attempt-a/baseline-observation.json",
      "sha256": "fe3fe050759572c756dc95ed59908e9ed1b0234785c3c9f89400d63e92bf2532"
    },
    {
      "path": "harness/verification/discovery/http/evidence/H01-attempt-a/baseline-producer-compile.log",
      "sha256": "bc62e7458734f481ac5d0105963a6d31a7379383c1830489646f8fcc01945821"
    },
    {
      "path": "harness/verification/discovery/http/evidence/H01-attempt-a/baseline.patch",
      "sha256": "e3b0c44298fc1c149afbf4c8996fb92427ae41e4649b934ca495991b7852b855"
    },
    {
      "path": "harness/verification/discovery/http/evidence/H01-attempt-a/changed-boundary-test.log",
      "sha256": "4df9bbc8380e519c23ea21a4fa9444db8a21850c19bada6ae685181299c7bab2"
    },
    {
      "path": "harness/verification/discovery/http/evidence/H01-attempt-a/changed-junit.xml",
      "sha256": "fbd8481cd0a20504e1c3ec975d75ba98af327ef8ba0839ca2dbb995f4239655f"
    },
    {
      "path": "harness/verification/discovery/http/evidence/H01-attempt-a/changed-observation.json",
      "sha256": "9714758fc1b4479c52a374f985bb63f062c2fc6bc834badc8126588caa645116"
    },
    {
      "path": "harness/verification/discovery/http/evidence/H01-attempt-a/changed-producer-compile.log",
      "sha256": "a71f452d5a695861c480e94e838739c3899192f3f092f3f2d465c483051af935"
    },
    {
      "path": "harness/verification/discovery/http/evidence/H01-attempt-a/changed.patch",
      "sha256": "fbf6c55e36153858ed5d02d6cc5d84e09cdaa1003b493250b0d10395226b1deb"
    },
    {
      "path": "harness/verification/discovery/http/evidence/H01-attempt-a/criteria.json",
      "sha256": "505e1b8feefed3e1ce8cb0df945b27521bc226db93c970eb921e94c69512bbbe"
    },
    {
      "path": "harness/verification/discovery/http/evidence/H01-attempt-a/faulted-repair-boundary-test.log",
      "sha256": "3ccb24794cbd0289ed89804eb129b7f8f997f84e1c618520b818668f18c06c6e"
    },
    {
      "path": "harness/verification/discovery/http/evidence/H01-attempt-a/faulted-repair-junit.xml",
      "sha256": "f2bc544177332cbfb33b9cdef11ecb46aec4e96195b329de8fd8292546d95af4"
    },
    {
      "path": "harness/verification/discovery/http/evidence/H01-attempt-a/faulted-repair-observation.json",
      "sha256": "9714758fc1b4479c52a374f985bb63f062c2fc6bc834badc8126588caa645116"
    },
    {
      "path": "harness/verification/discovery/http/evidence/H01-attempt-a/faulted-repair-producer-compile.log",
      "sha256": "e3c02b86ffe50c90a33259ad6df8369a1357f012beb3854ff3cbd329be57fbe9"
    },
    {
      "path": "harness/verification/discovery/http/evidence/H01-attempt-a/faulted-repair.patch",
      "sha256": "587928ba04ab238bb211fc1f0d0373fb597479fdf693904d97484e5e88a58929"
    },
    {
      "path": "harness/verification/discovery/http/evidence/H01-attempt-a/manifest.json",
      "sha256": "7acb79b4f9f7561cd830d024c3dd46be529ae3bc36f0bb5bacdb206e0a315c90"
    },
    {
      "path": "harness/verification/discovery/http/evidence/H01-attempt-a/repaired-boundary-test.log",
      "sha256": "249d7cf634c7337ea2681f6e18d4003ab90caf7a5a85df7f08511293bc7154bd"
    },
    {
      "path": "harness/verification/discovery/http/evidence/H01-attempt-a/repaired-junit.xml",
      "sha256": "d961211f5f631b1ed67e6f80c6dd1e063b703f86ac0778d440286e4f9bf63dd0"
    },
    {
      "path": "harness/verification/discovery/http/evidence/H01-attempt-a/repaired-observation.json",
      "sha256": "02aca7b29d8147bc78624b82d993fd2bbbe69f179f3630d685c393cfaf4532ac"
    },
    {
      "path": "harness/verification/discovery/http/evidence/H01-attempt-a/repaired-producer-compile.log",
      "sha256": "1cdf3a1839506cb7ff44ed87175afc2a308fe9fcee354934a4d76286686b2abb"
    },
    {
      "path": "harness/verification/discovery/http/evidence/H01-attempt-a/repaired.patch",
      "sha256": "5f455700a38f83b6beedf2328695dd2ffb0fff4514375dbed830bce1b44a2497"
    },
    {
      "path": "harness/verification/discovery/web/closure/evidence/BasketClosureTest.java",
      "sha256": "9d69eda798563f8c28b1ab01633d4d3ab43d94213850e8c6c08dcd24fd8f0ef0"
    },
    {
      "path": "harness/verification/discovery/web/closure/evidence/CurrencyClosure.test.tsx",
      "sha256": "43fc628f05ccf8f5f47386d6f5e38534d32ed925d22a92510f2947fef93d98e0"
    },
    {
      "path": "harness/verification/discovery/web/closure/evidence/H01-baseline-bff.json",
      "sha256": "3ad6b812a37d40c8d90de361580558f3bf0af0c9c6c0100b4214ec67ee5d8d7e"
    },
    {
      "path": "harness/verification/discovery/web/closure/evidence/H01-baseline-forward-TEST-com.poc.bff.api.ForwardWireTest.xml",
      "sha256": "1fe1bf37fdd57f9e1933e0520948c3479285820dcd1d6dae56f8b379f6f4a7a9"
    },
    {
      "path": "harness/verification/discovery/web/closure/evidence/H01-baseline-forward-com.poc.bff.api.ForwardWireTest.txt",
      "sha256": "47565b6b1932f7888bdf3e55bd74f28c0ca65b0ce0f15b97461b52178936385f"
    },
    {
      "path": "harness/verification/discovery/web/closure/evidence/H01-baseline-forward.log",
      "sha256": "ae2e0bb0c2370e0ddf584402096f879ac243e873acd4dfdd442cf9b576d02890"
    },
    {
      "path": "harness/verification/discovery/web/closure/evidence/H01-baseline-origin-TEST-com.poc.catalog.CatalogWireTest.xml",
      "sha256": "fe59bd30e06bcead6c827da1240eb31cfb8f7b2e2db9b9a5c30e4aa12f571f49"
    },
    {
      "path": "harness/verification/discovery/web/closure/evidence/H01-baseline-origin-com.poc.catalog.CatalogWireTest.txt",
      "sha256": "d0d8c3bf88414af68f7efc50a149bd033ebe5573bb2539d173ef69ad52c7b21a"
    },
    {
      "path": "harness/verification/discovery/web/closure/evidence/H01-baseline-origin.log",
      "sha256": "c64008799d449e656da01f50798f04d2fbbe51b56219b6f2bb24dc811b8b9a22"
    },
    {
      "path": "harness/verification/discovery/web/closure/evidence/H01-baseline-provider.json",
      "sha256": "3ad6b812a37d40c8d90de361580558f3bf0af0c9c6c0100b4214ec67ee5d8d7e"
    },
    {
      "path": "harness/verification/discovery/web/closure/evidence/H01-baseline-provider.json.cache.json",
      "sha256": "3ad6b812a37d40c8d90de361580558f3bf0af0c9c6c0100b4214ec67ee5d8d7e"
    },
    {
      "path": "harness/verification/discovery/web/closure/evidence/H01-baseline-web.log",
      "sha256": "81772e979bb7f1c078d0bcc0aaeb54addc95017ae05ed20a5f88dfa844388ac9"
    },
    {
      "path": "harness/verification/discovery/web/closure/evidence/H01-changed-bff.json",
      "sha256": "96c3c1f1dfac3c9bbeb27d11d019f3aec5afb4428889a3a9502503afd781e6a3"
    },
    {
      "path": "harness/verification/discovery/web/closure/evidence/H01-changed-forward-TEST-com.poc.bff.api.ForwardWireTest.xml",
      "sha256": "10d4f3a1a425ef92fdc75f10431140fbe5ff6c0d7ef23895c4e443272b9a44c5"
    },
    {
      "path": "harness/verification/discovery/web/closure/evidence/H01-changed-forward-com.poc.bff.api.ForwardWireTest.txt",
      "sha256": "2e05cb3ba11c33a7b3162a01b1fae243d7c2c25b66c0a21b65d3545c94e74a71"
    },
    {
      "path": "harness/verification/discovery/web/closure/evidence/H01-changed-forward.log",
      "sha256": "b7c6c81c7f1c1893b8d8a95faf1ab917e7b43939ce1d531f4c67f6e24acd85a0"
    },
    {
      "path": "harness/verification/discovery/web/closure/evidence/H01-changed-origin-TEST-com.poc.catalog.CatalogWireTest.xml",
      "sha256": "86e9374a33060f6d0a9d7b4d4670b04c0a232b6a6c141b49ee139da1c11fd5d6"
    },
    {
      "path": "harness/verification/discovery/web/closure/evidence/H01-changed-origin-com.poc.catalog.CatalogWireTest.txt",
      "sha256": "83de68fa96d09fd4287af2015f44de44abcdcdca3e3aacb39ba37ab8444e319c"
    },
    {
      "path": "harness/verification/discovery/web/closure/evidence/H01-changed-origin.log",
      "sha256": "c64008799d449e656da01f50798f04d2fbbe51b56219b6f2bb24dc811b8b9a22"
    },
    {
      "path": "harness/verification/discovery/web/closure/evidence/H01-changed-provider.json",
      "sha256": "96c3c1f1dfac3c9bbeb27d11d019f3aec5afb4428889a3a9502503afd781e6a3"
    },
    {
      "path": "harness/verification/discovery/web/closure/evidence/H01-changed-provider.json.cache.json",
      "sha256": "96c3c1f1dfac3c9bbeb27d11d019f3aec5afb4428889a3a9502503afd781e6a3"
    },
    {
      "path": "harness/verification/discovery/web/closure/evidence/H01-changed-web.log",
      "sha256": "0fa702f9ac612560fcd5b760aa8076f05d744e8b62e03a5774e8dfb1ecc144c0"
    },
    {
      "path": "harness/verification/discovery/web/closure/evidence/H01-fault-web-build.log",
      "sha256": "a72553397ccaf9a6bda4498594f877b19a7cbc2076298d575cf05bb76d97bbbc"
    },
    {
      "path": "harness/verification/discovery/web/closure/evidence/H01-faulty-repair-web.log",
      "sha256": "3d14b8773ac03d07819ce80113bda9c0153288f30df67a45869ddb0d37395e66"
    },
    {
      "path": "harness/verification/discovery/web/closure/evidence/H01-repaired-web-build.log",
      "sha256": "f90753b23bf48d383a120c15505060f6be00c9a4ceaa3a97f637586a48e53262"
    },
    {
      "path": "harness/verification/discovery/web/closure/evidence/H01-repaired-web.log",